{
  "session_id": "SES-DEMO-0001",
  "project_id": "RWE-P2088",
  "build_id": "RWE-P2088-BUILD-098",
  "installation_id": "INS-DEMO-0001",
  "tester_id": "TST-DEMO-001",
  "player_instance_id": "PLY-DEMO-0001",
  "state": "OPEN",
  "created_at": "2026-09-20T10:00:00Z",
  "opened_at": "2026-09-20T10:00:01Z",
  "last_activity_at": "2026-09-20T10:14:31Z",
  "ended_at": null,
  "end_reason": null,
  "end_requested": false,
  "recovery_status": "clean",
  "pending_event_count": 0,
  "first_queued_at": null,
  "last_queued_at": null
}